<?xml version="1.0" encoding="UTF-8"?>
<?xml-stylesheet type="text/xsl" href="index.xsl"?>
<ricetteDB xmlns:xsi="http://www.w3.org/2001/XMLSchema-instance" xsi:schemaLocation=" 4forchette.xsd"><!-- non so bene che valori bisogna sostiture in questi attributi -->
		<ricetta IDCode="1"><!--credo che vada messo un codice identificativo per ogni ricetta-->
			<nomePiatto>Risotto agli asparagi</nomePiatto>
			<categoria>Primo</categoria>
			<autore>WWW.MISYA.INFO</autore>
			<descrizione>
				Il risotto agli asparagi e' una tipica ricetta primaverile,la prima ricetta con
				gli asparagi che trovate sul mio blog e questo perch√© sono i nemici giurati di
				mio marito, odia gli asparagi pi√π di quanto non odi i carciofi e ho detto tutto!
				Indovinate invece chi e' un'estimatrice degli asparagi? La mia piccola
				meraviglia, che ha apprezzato e ha condiviso con me il mio piatto di risotto
				agli asparagi, e queste sono soddisfazioni. Non so dalle vostre parti, ma qui a
				Napoli, o almeno a casa mia, gli asparagi non sono cosi' radicati nelle nostre
				abitudini alimentari quindi ho iniziato con una cosa semplice come il risotto
				per poi preparare piu' in la' qualche altra cosina piu' sfiziosa. Bene, io vi
				saluto e vi auguro una buona giornata, bacibaci
			</descrizione>
			<imgPiatto>risottoasparagi.jpg</imgPiatto>
			<difficolta>1</difficolta>
			<quantePersone>4</quantePersone>
			<ingredienti>
				<ingr>300 gr di riso</ingr>
				<ingr>400 gr di asparagi</ingr>
				<ingr>1 litro di brodo vegetale</ingr>
				<ingr>1 scalogno</ingr>
				<ingr>vino bianco</ingr>
				<ingr>40 gr di parmigiano</ingr>
				<ingr>30 gr di burro</ingr>
				<ingr>olio di oliva</ingr>
				<ingr>sale</ingr>
				<ingr>pepe bianco</ingr>
			</ingredienti>
			<tempoPreparazione unitaMisura="minuti">20</tempoPreparazione>
			<procedimento>
				Pulite gli asparagi e una volta
				mondati lessateli in acqua appena salata per 5 minuti.
				Scolateli e tagliateli a pezzetti avendo cura di tenere da parte alcune punte
				per la decorazione finale del piatto.
				Nell'acqua in cui avrete cotto gli asparagi, aggiungete un dado vegetale (io uso
				quello fatto in casa) cosi' da ottenere il brodo che vi servira' durante la cottura.
				Tritate lo scalogno finemente, mettetelo in una casseruola con l'olio e fatelo
				appassire
				Aggiungete il riso e fatelo tostare per un paio di minuti
				Quindi aggiungete il vino bianco e lasciatelo sfumate.
				Aggiungete il brodo vegetale un mestolo per volta aggiungendolo man mano fino a
				cuocere completamente il riso.
				A meta' cottura del risotto, aggiungete gli asparagi, aggiustate di sale e
				mescolare
				A fine cottura spegnete la fiamma e mantecate il risotto aggiungete burro e
				parmigiano
				Lasciar riposare il risotto agli asparagi un paio di minuti prima di servirlo
				guarnendo il piatto con pepe bianco e le punte degli asparagi che avevate tenuto
				da parte.
			</procedimento>
		</ricetta>
		<ricetta IDCode="2">
			<nomePiatto>Tiramisu'</nomePiatto>
			<categoria>Dessert</categoria>
			<autore>www.gustissimo.it</autore>
			<descrizione>
				Il tiramis√π e' un dolce diffuso in tutta Italia, le cui origini vengono spesso contese fra regioni quali il Veneto, il Friuli Venezia Giulia, il Piemonte e altre. √à un dessert al cucchiaio a base di savoiardi, o altri biscotti di consistenza friabile, inzuppati nel caffe'
			  , mascarpone, uova e zucchero.
			</descrizione>
			<imgPiatto>tiramisu.jpg</imgPiatto>
			<difficolta>1</difficolta>
			<quantePersone>8</quantePersone>
			<ingredienti>
				<ingr>600 gr. di Savoiardi</ingr>
				<ingr>120 gr. di Zucchero</ingr>
				<ingr>5 Uova</ingr>
				<ingr>500 gr. di Mascarpone</ingr>
				<ingr>Cacao in polvere q.b.</ingr>
				<ingr>Caffe' q.b.</ingr>
				<ingr>30 ml di Rum</ingr>
			</ingredienti>
			<tempoPreparazione unitaMisura="minuti">30</tempoPreparazione>
			<procedimento>
				Preparate un caffe' con la moka, lasciatelo intiepidire e correggetelo col rum. Versatelo in una ciotola abbastanza larga da poterci inzuppare i savoiardi uno ad uno. Adagiate i biscotti in una vaschetta di plastica (in commercio troverete facilmente quelle fatte apposta per il tiramis√π) foderando completamente il fondo.
				Sbattete i tuorli delle uova con met√† dello zucchero, aggiungete il mascarpone e mescolate con un cucchiaio di legno fino ad ottenere un composto ben amalgamato.
				Montate a parte gli albumi montati a neve e lo zucchero restante. Incorporate il tutto delicatamente.
				A questo punto avrete ottenuto una crema che distenderete con l‚Äôaiuto di un cucchiaio o di una spatola a formare uno strato sopra i savoiardi.
				Coprite il tutto con una spolverata di cacao in polvere aiutandovi con un colino, poi procedete a formare un altro strato di savoiardi e crema.
				Riponete in frigorifero a riposare per qualche ora.
				Al momento di servire ricoprite il vostro tiramis√π con un‚Äôultima abbondante spolverata di cacao in polvere.
				I savoiardi vanno intinti nel caff√© molto velocemente, per evitare che si impregnino troppo e si sbriciolino.
				Amalgamando i vari ingredienti, usate l‚Äôaccortezza di mescolare sempre nello stesso verso.
				Le uova devono essere freschissime.
				Se amate i sapori amari, potete aggiungere alla polvere di cacao anche un po‚Äô di polvere di caff√©.
				Con l‚Äôaiuto di sagome di cartone potete decorare a piacimento la superficie del dolce, anche con scritte di auguri.
			</procedimento>
		</ricetta>
  		<ricetta IDCode="3">
			<nomePiatto>Pasta con crema ai carciofi</nomePiatto>
			<categoria>Primo</categoria>
			<autore>WWW.MISYA.INFO</autore>
			<descrizione>
			Buond√¨, questa domenica vi propongo la pasta con crema di carciofi e pancetta croccante,
			un primo piatto che adoro ma che non preparo quasi mai perch√© Ivano detesta i carciofi.
			Ma quando a pranzo trovo la giusta compagnia, questo e‚Äô uno dei modi di utilizzare i carciofi che preferisco
		        e ho scoperto che la pasta condita con la crema di carciofi piace anche alla piccola.
			Amiche spero che abbiate trascorso un buon San Valentino e di essere riuscita anche quest‚Äôanno a darvi
		        qualche spunto in pi√π in cucina, noi ieri sera alla fine, dopo una giornata fuori casa,
			abbiamo cenato con pizza, birra e baci perugina üòâ Oggi, vista la pioggia, siamo casalinghi,
			per il momento siamo ancora a letto a vedere i cartoni animati, quindi vi lascio alla ricetta di oggi
			e vado a spupazzarmi i miei amori. Buona domenica a chi passa si qui
			</descrizione>
			<imgPiatto>cremacarciofi.jpg</imgPiatto>
			<difficolta>2</difficolta>
			<quantePersone>4</quantePersone>
			<ingredienti>
				<ingr>4 carciofi</ingr>
				<ingr>320gr di pasta</ingr>
				<ingr>1/2 cipolla</ingr>
				<ingr>200ml di brodo vegetale</ingr>
				<ingr>25gr di parmiggiano</ingr>
				<ingr>50gr di pancetta</ingr>
				<ingr>prezzemolo</ingr>
				<ingr>olio di oliva</ingr>
				<ingr>sale</ingr>
				<ingr>pepe</ingr>
			  	<ingr>1/2 limone</ingr>
			</ingredienti>
			<tempoPreparazione unitaMisura="minuti">20</tempoPreparazione>
			<procedimento>
			Pulite i carciofi. Poi tagliateli a spicchietti, e metteteli in acqua
			  e limone per 30 minuti. Tritate la cipolla e mettetela nella padella
			  con l'olio, poi aggiungete i carciofi, salate
			  e fate insaporire per qualche minuto. Aggiungete il prezzemolo,
			  coprite con il brodo e fate cuocere con il coperchio per 10 minuti circa.
			  Frullate tutto con un mixer poi aggiungete il parmiggiano.
			  Nel frattempo cuocete la pasta in abbondante acqua salata, scolate al dente
			  e versante in padella con il condimento.
			  Rosolate i cubetti di pancetta in padella,servite la pasta con crema di carciofi nei piatti
			  aggiungendo prezzemolo tritato e cubetti di pancetta croccanti
			</procedimento>
		</ricetta>
	</ricetteDB>

<!-- by Luca  Last Update 14/04/2016 -->
